{
  "schemaVersion": "autovideo-shot-manifest/v1",
  "projectId": "demotext-standard-delivery-v1",
  "sourceAlignment": "audio/alignment.json",
  "narrationLock": "NarrationLock.json",
  "cueCount": 46,
  "timingUnit": "seconds",
  "captionPolicy": {
    "zone": "caption",
    "textType": "exact-source",
    "source": "NarrationLock exact cue text",
    "maxLines": 2
  },
  "defaultVisualOperation": "replace",
  "allowedScreenTextTypes": ["exact-source", "approved-summary", "generated-summary"],
  "allowedMotionRules": ["viewport-change", "svg-path-draw", "scale-swap-transition", "card-morph-anchor"],
  "shots": [
    {
      "cueId": "cue-001",
      "sceneId": "scene-01",
      "narration": "我奉劝很多人，对AI技术一定要有敬畏之心，也希望大家擦亮双眼。",
      "start": 0.0,
      "end": 4.78,
      "duration": 4.78,
      "screenText": {"text": "对AI技术一定要有敬畏之心", "type": "exact-source", "sourceCueIds": ["cue-001"]},
      "hostPose": "emphasis",
      "zones": ["host.left", "content.right", "caption"],
      "visualOperation": "enter",
      "motionRules": ["scale-swap-transition"]
    },
    {
      "cueId": "cue-002",
      "sceneId": "scene-02",
      "narration": "这个市场上有无数所谓的AI、Coze、Dify社群，告诉你应该怎么做。",
      "start": 4.78,
      "end": 9.04,
      "duration": 4.26,
      "screenText": {"text": "AI、Coze、Dify社群", "type": "exact-source", "sourceCueIds": ["cue-002"]},
      "hostPose": "read",
      "zones": ["host.right", "content.left", "caption"],
      "visualOperation": "replace",
      "motionRules": ["card-morph-anchor"]
    },
    {
      "cueId": "cue-003",
      "sceneId": "scene-02",
      "narration": "但是这里面99%的人，他并不具备开发和维护AI的能力，他完全看不懂底层的代码。",
      "start": 9.04,
      "end": 15.14,
      "duration": 6.1,
      "screenText": {"text": "99%的人", "type": "exact-source", "sourceCueIds": ["cue-003"], "claimFraming": "creator-opinion-unverified", "statisticalChartAllowed": false},
      "hostPose": "read",
      "zones": ["host.right", "content.left", "caption"],
      "visualOperation": "compact",
      "motionRules": ["card-morph-anchor", "scale-swap-transition"]
    },
    {
      "cueId": "cue-004",
      "sceneId": "scene-03",
      "narration": "AI也并不是你想的那么简单。",
      "start": 15.14,
      "end": 16.74,
      "duration": 1.6,
      "screenText": {"text": "AI也并不是你想的那么简单", "type": "exact-source", "sourceCueIds": ["cue-004"]},
      "hostPose": "think",
      "zones": ["host.left", "content.right", "caption"],
      "visualOperation": "replace",
      "motionRules": ["scale-swap-transition"]
    },
    {
      "cueId": "cue-005",
      "sceneId": "scene-03",
      "narration": "我看到很多人用完Codex、Claude Code，都觉得自己是大神，就一下子支棱起来了，觉得自己是被掩埋的技术天才，强得可怕，会搭工作流，会写提示词，然后生成一个Agent。",
      "start": 16.74,
      "end": 27.3,
      "duration": 10.56,
      "screenText": {"text": "会搭工作流 ≠ 懂系统", "type": "generated-summary", "sourceCueIds": ["cue-004", "cue-005"], "generationReceipt": "VIDEO_TASK.md#Visual-Thesis"},
      "hostPose": "think",
      "zones": ["host.left", "content.right", "caption"],
      "visualOperation": "replace",
      "motionRules": ["scale-swap-transition", "viewport-change"]
    },
    {
      "cueId": "cue-006",
      "sceneId": "scene-04",
      "narration": "尤其是应届生，投了很多简历，说AI并不好找工作。",
      "start": 27.3,
      "end": 31.5,
      "duration": 4.2,
      "screenText": {"text": "AI并不好找工作", "type": "exact-source", "sourceCueIds": ["cue-006"]},
      "hostPose": "present",
      "zones": ["host.right", "content.left", "caption"],
      "visualOperation": "replace",
      "motionRules": ["scale-swap-transition"]
    },
    {
      "cueId": "cue-007",
      "sceneId": "scene-04",
      "narration": "我可以非常明确地告诉你，这个市场上90%的人，他对底层逻辑是完全不清晰的。",
      "start": 31.5,
      "end": 38.74,
      "duration": 7.24,
      "screenText": {"text": "90%的人", "type": "exact-source", "sourceCueIds": ["cue-007"], "claimFraming": "creator-opinion-unverified", "statisticalChartAllowed": false},
      "hostPose": "present",
      "zones": ["host.right", "content.left", "caption"],
      "visualOperation": "replace",
      "motionRules": ["card-morph-anchor"]
    },
    {
      "cueId": "cue-008",
      "sceneId": "scene-04",
      "narration": "他不是在构建一个可维护的系统，而是在拼接一个能演示的流程、一个Demo。",
      "start": 38.74,
      "end": 44.74,
      "duration": 6.0,
      "screenText": {"text": "可维护系统 ≠ 能演示的Demo", "type": "generated-summary", "sourceCueIds": ["cue-008"], "generationReceipt": "VIDEO_TASK.md#Visual-Thesis"},
      "hostPose": "present",
      "zones": ["host.right", "content.left", "caption"],
      "visualOperation": "compare",
      "motionRules": ["card-morph-anchor", "scale-swap-transition"]
    },
    {
      "cueId": "cue-009",
      "sceneId": "scene-05",
      "narration": "五个原因，对照一下，自己能理解的，月薪都不会低于30K。",
      "start": 44.74,
      "end": 49.34,
      "duration": 4.6,
      "screenText": {"text": "五个原因", "type": "exact-source", "sourceCueIds": ["cue-009"], "claimFraming": "author-framework"},
      "numericClaimTreatment": {"claim": "30K", "mainVisual": "caption-only", "statisticalChartAllowed": false, "guaranteeBadgeAllowed": false},
      "hostPose": "emphasis",
      "zones": ["host.left", "content.right", "caption"],
      "visualOperation": "compact",
      "motionRules": ["viewport-change", "scale-swap-transition"]
    },
    {
      "cueId": "cue-010",
      "sceneId": "scene-06",
      "narration": "第一，平台把系统的复杂性给隐藏起来。",
      "start": 49.34,
      "end": 52.56,
      "duration": 3.22,
      "screenText": {"text": "平台把系统的复杂性给隐藏起来", "type": "exact-source", "sourceCueIds": ["cue-010"]},
      "hostPose": "point-right",
      "zones": ["host.left", "content.right", "caption"],
      "visualOperation": "replace",
      "motionRules": ["card-morph-anchor", "viewport-change"]
    },
    {
      "cueId": "cue-011",
      "sceneId": "scene-06",
      "narration": "低代码、无代码、AI平台、工作流工具，把模型调用、API连接、向量库、工具链调度流程包装成了按钮和节点。",
      "start": 52.56,
      "end": 61.68,
      "duration": 9.12,
      "screenText": {"text": "包装成了按钮和节点", "type": "exact-source", "sourceCueIds": ["cue-011"]},
      "hostPose": "point-right",
      "zones": ["host.left", "content.right", "caption"],
      "visualOperation": "replace",
      "motionRules": ["svg-path-draw", "viewport-change"]
    },
    {
      "cueId": "cue-012",
      "sceneId": "scene-06",
      "narration": "好处是普通人可以快速上手，坏处是很多人误以为会拖拽节点就等于懂系统架构。",
      "start": 61.68,
      "end": 67.56,
      "duration": 5.88,
      "screenText": {"text": "快速上手 ≠ 懂系统架构", "type": "generated-summary", "sourceCueIds": ["cue-012"], "generationReceipt": "VIDEO_TASK.md#Beat-Plan"},
      "hostPose": "point-right",
      "zones": ["host.left", "content.right", "caption"],
      "visualOperation": "compare",
      "motionRules": ["card-morph-anchor", "scale-swap-transition"]
    },
    {
      "cueId": "cue-013",
      "sceneId": "scene-06",
      "narration": "但一旦报错，你根本就不知道是模型问题、接口问题、权限问题、数据问题，还是上下游问题、状态管理问题。",
      "start": 67.56,
      "end": 74.9,
      "duration": 7.34,
      "screenText": {"text": "模型 / 接口 / 权限 / 数据 / 上下游 / 状态管理", "type": "generated-summary", "sourceCueIds": ["cue-013"], "generationReceipt": "plan/graph-ir.json#graph-hidden-complexity"},
      "hostPose": "point-right",
      "zones": ["host.left", "content.right", "caption"],
      "visualOperation": "compact",
      "motionRules": ["svg-path-draw", "viewport-change"]
    },
    {
      "cueId": "cue-014",
      "sceneId": "scene-07",
      "narration": "第二点，很多人把原型能力误判成是产品能力。",
      "start": 74.9,
      "end": 79.02,
      "duration": 4.12,
      "screenText": {"text": "原型能力 ≠ 产品能力", "type": "generated-summary", "sourceCueIds": ["cue-014"], "generationReceipt": "VIDEO_TASK.md#Beat-Plan"},
      "hostPose": "present",
      "zones": ["host.right", "content.left", "caption"],
      "visualOperation": "compare",
      "motionRules": ["card-morph-anchor"]
    },
    {
      "cueId": "cue-015",
      "sceneId": "scene-07",
      "narration": "AI最擅长帮你从0到1做一个Demo，每次帮你跑通一次，你就觉得自己做成了。",
      "start": 79.02,
      "end": 84.38,
      "duration": 5.36,
      "screenText": {"text": "从0到1做一个Demo", "type": "exact-source", "sourceCueIds": ["cue-015"]},
      "hostPose": "present",
      "zones": ["host.right", "content.left", "caption"],
      "visualOperation": "replace",
      "motionRules": ["card-morph-anchor", "scale-swap-transition"]
    },
    {
      "cueId": "cue-016",
      "sceneId": "scene-07",
      "narration": "但是真实的产品不是跑通一次就可以了，而是能够长期稳定地运行真实的业务，是有脏数据、异常输入、并发请求、成本控制、隐私安全等一系列的问题。",
      "start": 84.38,
      "end": 97.52,
      "duration": 13.14,
      "screenText": {"text": "长期稳定地运行真实的业务", "type": "exact-source", "sourceCueIds": ["cue-016"]},
      "hostPose": "present",
      "zones": ["host.right", "content.left", "caption"],
      "visualOperation": "replace",
      "motionRules": ["viewport-change", "card-morph-anchor"]
    },
    {
      "cueId": "cue-017",
      "sceneId": "scene-07",
      "narration": "当没有工程底座的时候，你的Demo越漂亮，后面塌得就越快。",
      "start": 97.52,
      "end": 101.74,
      "duration": 4.22,
      "screenText": {"text": "Demo越漂亮，后面塌得就越快", "type": "exact-source", "sourceCueIds": ["cue-017"]},
      "hostPose": "present",
      "zones": ["host.right", "content.left", "caption"],
      "visualOperation": "compact",
      "motionRules": ["scale-swap-transition", "viewport-change"]
    },
    {
      "cueId": "cue-018",
      "sceneId": "scene-08",
      "narration": "第三点，就是我觉得现在短视频它疯狂地在展示结果，没有去展示维护。",
      "start": 101.74,
      "end": 107.08,
      "duration": 5.34,
      "screenText": {"text": "展示结果，没有去展示维护", "type": "exact-source", "sourceCueIds": ["cue-018"]},
      "hostPose": "explain",
      "zones": ["host.left", "content.right", "caption"],
      "visualOperation": "compare",
      "motionRules": ["card-morph-anchor", "scale-swap-transition"]
    },
    {
      "cueId": "cue-019",
      "sceneId": "scene-08",
      "narration": "一个智能体自动生成报告、自动回复客户、自动剪辑视频，它看起来很震惊，但是没有人展示它失败的时候怎么去排查，没人展示日志怎么读，没人展示测试怎么做，没人展示边界条件怎么处理。",
      "start": 107.08,